{
  "schema_version": 1,
  "scene_id": "7083bf1f-9684-5acb-aa3a-d10cafdd264b",
  "name": "Axis Lab",
  "revision": 1,
  "active_camera_id": "a8d31808-fe78-5037-a920-fd2fa1aed080",
  "background_linear_rgb": [0.0, 0.0, 0.0],
  "entities": [
    {
      "id": "225a22d9-3059-5c76-8e84-240230f5e1f6",
      "name": "Hierarchy Parent",
      "components": {
        "Transform": {
          "position": [-4.0, 2.0, 0.0],
          "rotation_xyzw": [0.0, 0.0, 0.382683432365, 0.923879532511],
          "scale": [2.0, 2.0, 2.0],
          "parent_id": null
        },
        "PrimitiveMesh": {
          "primitive": "box"
        },
        "MaterialParameters": {
          "base_color_rgba": [0.0, 0.0, 0.0, 1.0],
          "emissive_rgb": [0.1, 0.1, 0.3]
        }
      }
    },
    {
      "id": "3d872e2a-5bc9-5e6c-b8ec-86eb1dfd32c2",
      "name": "Front-Facing Plane",
      "components": {
        "Transform": {
          "position": [3.5, -2.0, 0.0],
          "rotation_xyzw": [0.707106781187, 0.0, 0.0, 0.707106781187],
          "scale": [1.5, 1.0, 1.5],
          "parent_id": null
        },
        "PrimitiveMesh": {
          "primitive": "plane"
        },
        "MaterialParameters": {
          "base_color_rgba": [0.0, 0.0, 0.0, 1.0],
          "emissive_rgb": [1.0, 0.5, 0.0]
        }
      }
    },
    {
      "id": "62e658ab-fe06-538c-9039-40113b04258f",
      "name": "Y Marker (cylinder)",
      "components": {
        "Transform": {
          "position": [0.0, 2.0, 0.0],
          "rotation_xyzw": [0.0, 0.0, 0.0, 1.0],
          "scale": [0.3, 2.0, 0.3],
          "parent_id": null
        },
        "PrimitiveMesh": {
          "primitive": "cylinder"
        },
        "MaterialParameters": {
          "base_color_rgba": [0.0, 0.0, 0.0, 1.0],
          "emissive_rgb": [0.0, 1.0, 0.0]
        }
      }
    },
    {
      "id": "7236fd42-cf38-5012-95b2-c72307994404",
      "name": "X Marker (long box)",
      "components": {
        "Transform": {
          "position": [2.0, 0.0, 0.0],
          "rotation_xyzw": [0.0, 0.0, 0.0, 1.0],
          "scale": [2.0, 0.3, 0.3],
          "parent_id": null
        },
        "PrimitiveMesh": {
          "primitive": "box"
        },
        "MaterialParameters": {
          "base_color_rgba": [0.0, 0.0, 0.0, 1.0],
          "emissive_rgb": [1.0, 0.0, 0.0]
        }
      }
    },
    {
      "id": "7fa878f1-b15d-5ecf-9c68-f8e19a3dce56",
      "name": "Swatch Charcoal",
      "components": {
        "Transform": {
          "position": [1.5, -3.2, 2.0],
          "rotation_xyzw": [0.0, 0.0, 0.0, 1.0],
          "scale": [0.8, 0.8, 0.8],
          "parent_id": null
        },
        "PrimitiveMesh": {
          "primitive": "box"
        },
        "MaterialParameters": {
          "base_color_rgba": [0.03, 0.03, 0.034, 1.0],
          "emissive_rgb": [0.0, 0.0, 0.0]
        }
      }
    },
    {
      "id": "8cd47368-5863-57eb-a378-525d3cd12238",
      "name": "Origin Cube",
      "components": {
        "Transform": {
          "position": [0.0, 0.0, 0.0],
          "rotation_xyzw": [0.0, 0.0, 0.0, 1.0],
          "scale": [0.4, 0.4, 0.4],
          "parent_id": null
        },
        "PrimitiveMesh": {
          "primitive": "box"
        },
        "MaterialParameters": {
          "base_color_rgba": [0.0, 0.0, 0.0, 1.0],
          "emissive_rgb": [1.0, 1.0, 1.0]
        }
      }
    },
    {
      "id": "a8d31808-fe78-5037-a920-fd2fa1aed080",
      "name": "Main Camera",
      "components": {
        "Transform": {
          "position": [0.0, 0.0, 10.0],
          "rotation_xyzw": [0.0, 0.0, 0.0, 1.0],
          "scale": [1.0, 1.0, 1.0],
          "parent_id": null
        },
        "Camera": {
          "projection": "perspective",
          "fov_y_degrees": 60.0,
          "near_m": 0.1,
          "far_m": 1000.0
        }
      }
    },
    {
      "id": "afd10a00-a4ac-5252-956f-4395a66c20b4",
      "name": "Z Marker (flat box)",
      "components": {
        "Transform": {
          "position": [0.0, 0.0, 1.5],
          "rotation_xyzw": [0.0, 0.0, 0.0, 1.0],
          "scale": [0.5, 0.15, 1.5],
          "parent_id": null
        },
        "PrimitiveMesh": {
          "primitive": "box"
        },
        "MaterialParameters": {
          "base_color_rgba": [0.0, 0.0, 0.0, 1.0],
          "emissive_rgb": [0.0, 0.0, 1.0]
        }
      }
    },
    {
      "id": "b6032c9d-b7b9-5f02-9185-ceaa5905be78",
      "name": "Hierarchy Child",
      "components": {
        "Transform": {
          "position": [0.9, 0.0, 0.0],
          "rotation_xyzw": [0.0, 0.0, 0.0, 1.0],
          "scale": [0.2, 0.2, 0.2],
          "parent_id": "225a22d9-3059-5c76-8e84-240230f5e1f6"
        },
        "PrimitiveMesh": {
          "primitive": "box"
        },
        "MaterialParameters": {
          "base_color_rgba": [0.0, 0.0, 0.0, 1.0],
          "emissive_rgb": [1.0, 0.0, 0.5]
        }
      }
    },
    {
      "id": "b7489c15-cb66-5b2c-80f2-f192dbc07e3a",
      "name": "Back-Facing Plane",
      "components": {
        "Transform": {
          "position": [3.5, 2.5, 0.0],
          "rotation_xyzw": [-0.707106781187, 0.0, 0.0, 0.707106781187],
          "scale": [1.5, 1.0, 1.5],
          "parent_id": null
        },
        "PrimitiveMesh": {
          "primitive": "plane"
        },
        "MaterialParameters": {
          "base_color_rgba": [0.0, 0.0, 0.0, 1.0],
          "emissive_rgb": [1.0, 0.0, 1.0]
        }
      }
    },
    {
      "id": "d22ad718-ba31-5baa-8949-5c8801eb3aab",
      "name": "Depth Near Box",
      "components": {
        "Transform": {
          "position": [-3.0, -2.0, 1.0],
          "rotation_xyzw": [0.0, 0.0, 0.0, 1.0],
          "scale": [1.0, 1.0, 1.0],
          "parent_id": null
        },
        "PrimitiveMesh": {
          "primitive": "box"
        },
        "MaterialParameters": {
          "base_color_rgba": [0.0, 0.0, 0.0, 1.0],
          "emissive_rgb": [0.0, 1.0, 1.0]
        }
      }
    },
    {
      "id": "d8f400c7-d628-5ace-a9ad-72f45f407779",
      "name": "Depth Far Box",
      "components": {
        "Transform": {
          "position": [-3.5, -2.0, -2.0],
          "rotation_xyzw": [0.0, 0.0, 0.0, 1.0],
          "scale": [2.5, 2.5, 1.0],
          "parent_id": null
        },
        "PrimitiveMesh": {
          "primitive": "box"
        },
        "MaterialParameters": {
          "base_color_rgba": [0.0, 0.0, 0.0, 1.0],
          "emissive_rgb": [1.0, 1.0, 0.0]
        }
      }
    },
    {
      "id": "e2efe6c2-db71-5dec-96b7-d0c4f6b61d59",
      "name": "Swatch Floor",
      "components": {
        "Transform": {
          "position": [0.0, -3.6, 0.0],
          "rotation_xyzw": [0.0, 0.0, 0.0, 1.0],
          "scale": [12.0, 1.0, 5.0],
          "parent_id": null
        },
        "PrimitiveMesh": {
          "primitive": "plane"
        },
        "MaterialParameters": {
          "base_color_rgba": [0.18, 0.18, 0.18, 1.0],
          "emissive_rgb": [0.0, 0.0, 0.0]
        }
      }
    },
    {
      "id": "eaf9bff8-295d-5c3e-a94e-598a3199bbce",
      "name": "Swatch Deep Red",
      "components": {
        "Transform": {
          "position": [0.0, -3.2, 2.0],
          "rotation_xyzw": [0.0, 0.0, 0.0, 1.0],
          "scale": [0.8, 0.8, 0.8],
          "parent_id": null
        },
        "PrimitiveMesh": {
          "primitive": "box"
        },
        "MaterialParameters": {
          "base_color_rgba": [0.3, 0.022, 0.026, 1.0],
          "emissive_rgb": [0.0, 0.0, 0.0]
        }
      }
    },
    {
      "id": "fbaf5c08-f2ae-5ae3-9d4d-20fa70e2484f",
      "name": "Swatch Bronze",
      "components": {
        "Transform": {
          "position": [-1.5, -3.2, 2.0],
          "rotation_xyzw": [0.0, 0.0, 0.0, 1.0],
          "scale": [0.8, 0.8, 0.8],
          "parent_id": null
        },
        "PrimitiveMesh": {
          "primitive": "box"
        },
        "MaterialParameters": {
          "base_color_rgba": [0.48, 0.29, 0.12, 1.0],
          "emissive_rgb": [0.0, 0.0, 0.0]
        }
      }
    }
  ]
}
